{
  "schema": "jointbuildgs.two_host_handoff.v1",
  "template_only": false,
  "handoff_id": "P2-W2C-C1-C2-FEASIBILITY-PILOT-RECOVERY-R3-v1",
  "task_id": "P2-C1-C2-FEASIBILITY-PILOT-RECOVERY-R3-v1",
  "created_at": "2026-08-02T12:03:07+09:00",
  "direction": "work_to_experiment",
  "sender_role": "work_host",
  "receiver_role": "experiment_host",
  "state": "offered",
  "previous_receipt": null,
  "transport": {
    "mode": "serialized_main",
    "branch": "main",
    "target_branch": "main",
    "exclusive_writer_ack": true
  },
  "commits": {
    "base_main": "59c6b7f42b9444bf1bf92fe5e8c88d60c56d7513",
    "offered_head": "SELF",
    "receipt_head": "SELF"
  },
  "scope": {
    "allowed_paths": [
      "artifacts/manifests/handoffs/P2-W2C-C1-C2-FEASIBILITY-PILOT-RECOVERY-R3-v1",
      "artifacts/manifests/p2_baselines/c1_c2_feasibility_pilot_recovery_r3_v1",
      "docs/experiments/p2/c1_c2_feasibility_pilot_recovery_r3_v1",
      "docs/handoffs/returns/P2_C2W_C1_C2_FEASIBILITY_PILOT_RECOVERY_R3_RETURN_v1.md"
    ],
    "protected_paths": [
      "AGENTS.md",
      "CLAUDE.md",
      "artifacts/manifests/gate_s0",
      "artifacts/manifests/handoffs/P1-W2C-REPO-AUDIT-R2",
      "artifacts/manifests/handoffs/P2-W2C-GATE-S0-PREP-v1",
      "artifacts/manifests/handoffs/P2-W2C-GATE-S0-REMEDIATION-R1-v1",
      "artifacts/manifests/handoffs/P2-W2C-GATE-S0-EVIDENCE-R2A-v1",
      "artifacts/manifests/handoffs/P2-W2C-GATE-S0-COMMON-BASE-LINEAGE-R2B-v1",
      "artifacts/manifests/handoffs/P2-W2C-GATE-S0-INTEGRATED-FREEZE-CLOSURE-v1",
      "artifacts/manifests/handoffs/P2-W2C-GATE-S0-FREEZE-RECOVERY-v1",
      "artifacts/manifests/handoffs/P2-W2C-GATE-S0-UAS-REFERENCE-COVERAGE-R1-v1",
      "artifacts/manifests/handoffs/P2-W2C-GATE-S0-UAS-REFERENCE-COVERAGE-R1-RECOVERY-PROMOTE-v1",
      "artifacts/manifests/handoffs/P2-W2C-C1-C2-FEASIBILITY-PILOT-v1",
      "artifacts/manifests/handoffs/P2-W2C-C1-C2-FEASIBILITY-PILOT-RECOVERY-v1",
      "artifacts/manifests/handoffs/P2-W2C-C1-C2-FEASIBILITY-PILOT-RECOVERY-R2-v1",
      "artifacts/manifests/p2_baselines/c1_c2_feasibility_pilot_v1",
      "artifacts/manifests/p2_baselines/c1_c2_feasibility_pilot_recovery_v1",
      "artifacts/manifests/p2_baselines/c1_c2_feasibility_pilot_recovery_r2_v1",
      "configs/p2_baselines/c1_c2_feasibility_pilot_v1",
      "docs/evidence",
      "docs/experiments/p2/c1_c2_feasibility_pilot_v1",
      "docs/experiments/p2/c1_c2_feasibility_pilot_recovery_v1",
      "docs/experiments/p2/c1_c2_feasibility_pilot_recovery_r2_v1",
      "docs/handoffs/HANDOFF_INDEX.md",
      "docs/handoffs/P2_W2C_C1_C2_FEASIBILITY_PILOT_v1.md",
      "docs/handoffs/P2_W2C_C1_C2_FEASIBILITY_PILOT_RECOVERY_v1.md",
      "docs/handoffs/P2_W2C_C1_C2_FEASIBILITY_PILOT_RECOVERY_R2_v1.md",
      "docs/handoffs/P2_W2C_C1_C2_FEASIBILITY_PILOT_RECOVERY_R3_v1.md",
      "docs/handoffs/returns/P2_C2W_C1_C2_FEASIBILITY_PILOT_RETURN_v1.md",
      "docs/handoffs/returns/P2_C2W_C1_C2_FEASIBILITY_PILOT_RECOVERY_RETURN_v1.md",
      "docs/handoffs/returns/P2_C2W_C1_C2_FEASIBILITY_PILOT_RECOVERY_R2_RETURN_v1.md",
      "docs/research/00_RESEARCH_CHARTER.md",
      "docs/research/01_MASTER_ROADMAP.md",
      "docs/research/02_NOVELTY_MAP.md",
      "docs/research/03_DATA_AND_BASELINE_SCOPE.md",
      "docs/research/04_RESULT_AND_ACCEPTANCE_CONTRACT_v0.md",
      "docs/research/05_HANDOFF_PROTOCOL.md",
      "docs/research/06_DECISION_LOG.md",
      "docs/research/preregistration/fusion_w1",
      "docs/research/preregistration/quality_axis",
      "docs/research/preregistration/gate_s0",
      "phases/p0-audit",
      "phases/p2-gsjso",
      "scripts/p2_baselines/c1_c2_feasibility_pilot_v1",
      "scripts/repository",
      "tests/p2_baselines/c1_c2_feasibility_pilot_v1",
      "tests/repository"
    ],
    "dirty_wip": false,
    "snapshot_manifest": null
  },
  "verification": {
    "level": "git_only",
    "verifier_role": "work_host",
    "docker_image_digest": "sha256:e50ba5c7fd493ed524212c34e5e84f48bd94e66a70e0ecb6d00269f75309f986",
    "commands": [
      "network-disabled Docker focused R3 contract and repository tests",
      "network-disabled Docker zero-scientific-payload preflight",
      "pinned Roofer zero-scientific integration PASS",
      "bash -n and Git mode 100755 verification for exact R3 wrapper",
      "actual activated R3 packet authority parser PASS",
      "three independent exact-source reviews of 8346a1f40763a17b02f40e47dbe74c8102f0a76e"
    ],
    "tests": [
      {
        "name": "C1/C2 R3 runner/config/authority/restart/report tests",
        "passed": 27,
        "failed": 0
      },
      {
        "name": "two-host handoff and repository instruction-sync tests",
        "passed": 51,
        "failed": 0
      },
      {
        "name": "zero-scientific-payload preflight",
        "passed": 1,
        "failed": 0
      },
      {
        "name": "pinned Roofer zero-scientific integration",
        "passed": 1,
        "failed": 0
      },
      {
        "name": "independent exact-source reviews",
        "passed": 3,
        "failed": 0
      }
    ]
  },
  "artifacts": {
    "required_for_task": true,
    "availability": {
      "work_host": "manifest_only",
      "experiment_host": "manifest_only"
    },
    "records": [
      {
        "uri": "artifact://JointBuildGS/phase-payloads/p0-audit/data/work/gate_s0/freeze_recovery_v1/P2-GATE-S0-FREEZE-RECOVERY-v1/reference/c1_grid_v1.npz",
        "bytes": 3023643,
        "sha256": "4f72178551e25ef27a952a09faa8331c1464416fcd6c5f66a57a9424e7f0b77b",
        "verification_method": "not_verified",
        "verified_by": null,
        "verified_at": null
      },
      {
        "uri": "artifact://JointBuildGS/phase-payloads/p0-audit/data/work/gate_s0/freeze_recovery_v1/P2-GATE-S0-FREEZE-RECOVERY-v1/checkpoints/050-c1_reference_frozen_pre_c5.json",
        "bytes": 3140,
        "sha256": "530a2a001189c7c0a4dfa486349b77d80ee5031e2a8b4024793405837dc1611e",
        "verification_method": "not_verified",
        "verified_by": null,
        "verified_at": null
      },
      {
        "uri": "artifact://JointBuildGS/phase-payloads/p0-audit/data/work/gate_s0/freeze_recovery_v1/P2-GATE-S0-FREEZE-RECOVERY-v1/common/mvs_class26_v1.ply",
        "bytes": 7327590,
        "sha256": "c7d63387d720dc4028c2b00e9cc6abb83d41161d6f033199ee619765fdfaf8dd",
        "verification_method": "not_verified",
        "verified_by": null,
        "verified_at": null
      },
      {
        "uri": "artifact://JointBuildGS/phase-payloads/p0-audit/data/work/gate_s0/freeze_recovery_v1/P2-GATE-S0-FREEZE-RECOVERY-v1/checkpoints/030-dense_mvs_and_gravity.json",
        "bytes": 2951,
        "sha256": "b301d3dc7dec2423ff5760c47db4dfef4f62e919b5aac5808a30c82a9330a8f8",
        "verification_method": "not_verified",
        "verified_by": null,
        "verified_at": null
      },
      {
        "uri": "artifact://JointBuildGS/phase-payloads/p0-audit/data/work/gate_s0/uas_reference_coverage_r1_v1/P2-GATE-S0-UAS-REFERENCE-COVERAGE-R1-v1/reference/reference_candidate_cells_v1.csv",
        "bytes": 3785261,
        "sha256": "bf87736227ea3c28bc8f966f36e2498f786d2de420a732fa0bfebbb73664275a",
        "verification_method": "not_verified",
        "verified_by": null,
        "verified_at": null
      }
    ]
  },
  "scientific": {
    "technical_state": "pending",
    "scientific_verdict": null,
    "promotion_status": "not_requested"
  },
  "receiver_ack": null
}
