{"schema":"jointbuildgs.two_host_handoff.v1","template_only":false,"handoff_id":"P2-W2C-REPRESENTATIVE-COMPARISON-MATRIX-SAMPLE-v2","task_id":"P2-REPRESENTATIVE-COMPARISON-MATRIX-SAMPLE-v2","created_at":"2026-08-03T18:27:55+09:00","direction":"work_to_experiment","sender_role":"work_host","receiver_role":"experiment_host","state":"closed","previous_receipt":{"path":"artifacts/manifests/handoffs/P2-W2C-REPRESENTATIVE-COMPARISON-MATRIX-SAMPLE-v2/200-blocked.json","sha256":"f6d6c22b934406862e0b26d5316313c8380ae9ff7fa6eea5e3e9e840d93a90d5"},"transport":{"mode":"serialized_main","branch":"main","target_branch":"main","exclusive_writer_ack":true},"commits":{"base_main":"5100f5e0d4e0ab50b4e87fab348127fadc1db919","offered_head":"062cdd815b33f7c6e65bdf7a44c6025ca24f1b03","receipt_head":"SELF"},"scope":{"allowed_paths":["artifacts/manifests/handoffs/P2-W2C-REPRESENTATIVE-COMPARISON-MATRIX-SAMPLE-v2","artifacts/manifests/p2/representative_comparison_matrix_sample_v2","docs/experiments/p2/representative_comparison_matrix_sample_v2","docs/handoffs/returns/P2_C2W_REPRESENTATIVE_COMPARISON_MATRIX_SAMPLE_RETURN_v2.md"],"protected_paths":["AGENTS.md","CLAUDE.md",".gitattributes","configs","scripts","src","tests","docs/research","docs/evidence","docs/handoffs/P2_W2C_REPRESENTATIVE_COMPARISON_MATRIX_SAMPLE_v2.md","docs/handoffs/returns/P2_C2W_REPRESENTATIVE_COMPARISON_MATRIX_SAMPLE_RETURN_v1.md","artifacts/manifests/handoffs/P2-W2C-REPRESENTATIVE-COMPARISON-MATRIX-SAMPLE-v1","artifacts/manifests/p2/representative_comparison_matrix_sample_v1","phases"],"dirty_wip":false,"snapshot_manifest":null},"verification":{"level":"artifact_verified","verifier_role":"experiment_host","docker_image_digest":"sha256:251f83c17879a83b0c3dda5b9d71cbf45ca72cc0fdcbc89994194dc3edb86774","commands":["verify direct-child closure of v2 blocked receipt","verify v2 partial preserved without rerun","return writer to Work Host"],"tests":[{"name":"blocked receipt lineage","passed":1,"failed":0},{"name":"v2 partial preservation","passed":1,"failed":0},{"name":"v2 reruns after failure","passed":0,"failed":0},{"name":"scientific verdict null","passed":1,"failed":0}]},"artifacts":{"required_for_task":true,"availability":{"work_host":"manifest_only","experiment_host":"verified_local"},"records":[{"uri":"artifact://JointBuildGS/phase-payloads/p2/utarget199_contract_results_v1/P2-UTARGET199-CONTRACT-RESULTS-v1/results/building_method_metrics_v1.jsonl","bytes":1860023,"sha256":"13728f8e56ddfa502fea9d6345bb38b29931737f8e33d73d40b1b3b8171f6c8e","verification_method":"closed_attestation_reuse","verified_by":"experiment_host","verified_at":"2026-08-03T18:05:50+09:00"},{"uri":"artifact://JointBuildGS/phase-payloads/p2/utarget199_contract_results_v1/P2-UTARGET199-CONTRACT-RESULTS-v1/freeze/utarget199_reference_cells_v1.jsonl","bytes":11934242,"sha256":"ae62bc358dfdde604892305d44f3ff599288f00234a1622292d75596ba952f22","verification_method":"closed_attestation_reuse","verified_by":"experiment_host","verified_at":"2026-08-03T18:05:50+09:00"},{"uri":"artifact://JointBuildGS/phase-payloads/p2/utarget199_contract_results_v1/P2-UTARGET199-CONTRACT-RESULTS-v1/freeze/execution_units_v1.jsonl","bytes":30446,"sha256":"3763ca747d80d1a83a80b8c7e5add866753fbde58be3ea3dcf5ac3849427f2d7","verification_method":"closed_attestation_reuse","verified_by":"experiment_host","verified_at":"2026-08-03T18:05:50+09:00"}],"attestation_reuse":{"source_handoff_id":"P2-W2C-REPRESENTATIVE-COMPARISON-MATRIX-SAMPLE-v1","source_task_id":"P2-REPRESENTATIVE-COMPARISON-MATRIX-SAMPLE-v1","source_receipt_path":"artifacts/manifests/handoffs/P2-W2C-REPRESENTATIVE-COMPARISON-MATRIX-SAMPLE-v1/300-closed.json","source_receipt_commit":"2c69f5eb9640f39b584c6bfda0844486745dec8e","source_receipt_sha256":"4ccc9cf3625e3dd5edffc2ac78122620cd1d577583705f5882ed41712527fdf4","record_identity_sha256":"83808b3067ad7d8d9be80fdbe24b266942ea9f6ff5f8515e5bec10049c240312"}},"scientific":{"technical_state":"complete","scientific_verdict":null,"promotion_status":"not_requested"},"receiver_ack":{"role":"experiment_host","accepted_at":"2026-08-03T18:27:55+09:00","status":"closed","issue":"Lifecycle closed after missing C3 source block; v2 remains unsuccessful and writer returned for bounded v3 selection preflight."}}
