{
  "schema": "jointbuildgs.two_host_handoff.v1",
  "template_only": false,
  "handoff_id": "P2-W2C-C1-C2-COMPARISON-MATRIX-SAMPLE-v4",
  "task_id": "P2-C1-C2-COMPARISON-MATRIX-SAMPLE-v4",
  "created_at": "2026-08-03T19:52:12+09:00",
  "direction": "work_to_experiment",
  "sender_role": "work_host",
  "receiver_role": "experiment_host",
  "state": "accepted",
  "previous_receipt": {
    "path": "artifacts/manifests/handoffs/P2-W2C-C1-C2-COMPARISON-MATRIX-SAMPLE-v4/000-offered.json",
    "sha256": "2fa30c2fe4d37390b677435879173437f05dadeeef67832617570cb28f8de0e0"
  },
  "transport": {"mode": "serialized_main", "branch": "main", "target_branch": "main", "exclusive_writer_ack": true},
  "commits": {
    "base_main": "d539140b6b8260368dbac2faa806f26aaaff074f",
    "offered_head": "30012291a141259aebf70dd42cb6baa1ab1996cc",
    "receipt_head": "SELF"
  },
  "scope": {
    "allowed_paths": [
      "artifacts/manifests/handoffs/P2-W2C-C1-C2-COMPARISON-MATRIX-SAMPLE-v4",
      "artifacts/manifests/p2/c1_c2_comparison_matrix_sample_v4",
      "docs/experiments/p2/c1_c2_comparison_matrix_sample_v4",
      "docs/handoffs/returns/P2_C2W_C1_C2_COMPARISON_MATRIX_SAMPLE_RETURN_v4.md"
    ],
    "protected_paths": [
      "AGENTS.md", "CLAUDE.md", ".gitattributes", "configs", "scripts", "src", "tests",
      "docs/research", "docs/evidence", "docs/handoffs/P2_W2C_C1_C2_COMPARISON_MATRIX_SAMPLE_v4.md",
      "artifacts/manifests/handoffs/P2-W2C-C1-C2-COMPARISON-MATRIX-SAMPLE-v1",
      "artifacts/manifests/handoffs/P2-W2C-C1-C2-COMPARISON-MATRIX-SAMPLE-v2",
      "artifacts/manifests/p2/c1_c2_comparison_matrix_sample_v1",
      "docs/experiments/p2/c1_c2_comparison_matrix_sample_v1",
      "docs/experiments/p2/c1_c2_comparison_matrix_sample_v2",
      "docs/handoffs/returns/P2_C2W_C1_C2_COMPARISON_MATRIX_SAMPLE_RETURN_v1.md",
      "docs/handoffs/returns/P2_C2W_C1_C2_COMPARISON_MATRIX_SAMPLE_RETURN_v2.md",
      "artifacts/manifests/handoffs/P2-W2C-REPRESENTATIVE-COMPARISON-MATRIX-SAMPLE-v1",
      "artifacts/manifests/handoffs/P2-W2C-REPRESENTATIVE-COMPARISON-MATRIX-SAMPLE-v2",
      "artifacts/manifests/handoffs/P2-W2C-REPRESENTATIVE-COMPARISON-MATRIX-SAMPLE-v3",
      "artifacts/manifests/p2/representative_comparison_matrix_sample_v1",
      "artifacts/manifests/p2/representative_comparison_matrix_sample_v2",
      "artifacts/manifests/p2/representative_comparison_matrix_sample_v3",
      "phases"
    ],
    "dirty_wip": false,
    "snapshot_manifest": null
  },
  "verification": {
    "level": "artifact_verified",
    "verifier_role": "experiment_host",
    "docker_image_digest": "sha256:251f83c17879a83b0c3dda5b9d71cbf45ca72cc0fdcbc89994194dc3edb86774",
    "commands": [
      "validate exact C1/C2 v4 offer",
      "reuse exact closed source attestation",
      "verify six C1/C2 rows and complete terminal source binding",
      "verify canonical projection config, twelve raw camera projections and three reference-centered sections",
      "verify v4 final and partial output namespaces absent"
    ],
    "tests": [
      {"name": "offered receipt validator", "passed": 1, "failed": 0},
      {"name": "closed attestation reuse", "passed": 1, "failed": 0},
      {"name": "selected C1/C2 source rows", "passed": 6, "failed": 0},
      {"name": "unique terminal source bindings", "passed": 2, "failed": 0},
      {"name": "raw camera roof-reference projections", "passed": 12, "failed": 0},
      {"name": "reference-centered principal sections", "passed": 3, "failed": 0},
      {"name": "v4 final and partial namespace absence", "passed": 2, "failed": 0}
    ]
  },
  "artifacts": {
    "required_for_task": true,
    "availability": {"work_host": "manifest_only", "experiment_host": "verified_local"},
    "records": [
      {"uri": "artifact://JointBuildGS/phase-payloads/p2/utarget199_contract_results_v1/P2-UTARGET199-CONTRACT-RESULTS-v1/results/building_method_metrics_v1.jsonl", "bytes": 1860023, "sha256": "13728f8e56ddfa502fea9d6345bb38b29931737f8e33d73d40b1b3b8171f6c8e", "verification_method": "closed_attestation_reuse", "verified_by": "experiment_host", "verified_at": "2026-08-03T19:52:12+09:00"},
      {"uri": "artifact://JointBuildGS/phase-payloads/p2/utarget199_contract_results_v1/P2-UTARGET199-CONTRACT-RESULTS-v1/freeze/utarget199_reference_cells_v1.jsonl", "bytes": 11934242, "sha256": "ae62bc358dfdde604892305d44f3ff599288f00234a1622292d75596ba952f22", "verification_method": "closed_attestation_reuse", "verified_by": "experiment_host", "verified_at": "2026-08-03T19:52:12+09:00"},
      {"uri": "artifact://JointBuildGS/phase-payloads/p2/utarget199_contract_results_v1/P2-UTARGET199-CONTRACT-RESULTS-v1/freeze/execution_units_v1.jsonl", "bytes": 30446, "sha256": "3763ca747d80d1a83a80b8c7e5add866753fbde58be3ea3dcf5ac3849427f2d7", "verification_method": "closed_attestation_reuse", "verified_by": "experiment_host", "verified_at": "2026-08-03T19:52:12+09:00"}
    ],
    "attestation_reuse": {
      "source_handoff_id": "P2-W2C-REPRESENTATIVE-COMPARISON-MATRIX-SAMPLE-v1",
      "source_task_id": "P2-REPRESENTATIVE-COMPARISON-MATRIX-SAMPLE-v1",
      "source_receipt_path": "artifacts/manifests/handoffs/P2-W2C-REPRESENTATIVE-COMPARISON-MATRIX-SAMPLE-v1/300-closed.json",
      "source_receipt_commit": "2c69f5eb9640f39b584c6bfda0844486745dec8e",
      "source_receipt_sha256": "4ccc9cf3625e3dd5edffc2ac78122620cd1d577583705f5882ed41712527fdf4",
      "record_identity_sha256": "83808b3067ad7d8d9be80fdbe24b266942ea9f6ff5f8515e5bec10049c240312"
    }
  },
  "scientific": {"technical_state": "pending", "scientific_verdict": null, "promotion_status": "not_requested"},
  "receiver_ack": {
    "role": "experiment_host",
    "accepted_at": "2026-08-03T19:52:12+09:00",
    "status": "accepted",
    "issue": "Accepted for one C1/C2-only v4 reuse render in the canonical project mount; all prior partial namespaces remain untouched."
  }
}
